{
  "title": "Concrete name of one feature",
  "category": "capability",
  "pitch": "New outcome that the person could get.",
  "user_value": "Who would use it, in which situation, and why it matters.",
  "use_case": "An example of input, action, and observable result.",
  "novelty_delta": "Difference from what exists, or a clearly identified hypothesis.",
  "evidence": [],
  "novelty": {
    "assessment": "unknown",
    "confidence": "low",
    "inspected_scope": [],
    "uncertainty": "Template: no project has been inspected yet."
  },
  "prototype": {
    "mode": "simulation",
    "question": "Which concrete experience do we want to compare?",
    "observable": "What changes when you use the main control.",
    "limitations": ["Template: replace with the limits of the real demo."],
    "checks": [{"check": "Main interaction in the browser", "result": "not-run"}]
  },
  "open_question": "The main product uncertainty, without breaking it down into technical tasks.",
  "parent_ids": []
}
